{
  "$schema": "https://json-schema.org/draft/2020-12/schema",
  "$id": "https://40kdc.dev/schemas/core/unit-composition.schema.json",
  "title": "Unit Composition",
  "description": "Describes the internal model-type breakdown of a unit.",
  "type": "object",
  "properties": {
    "unit_id": { "$ref": "../defs/common.schema.json#/$defs/entity-id" },
    "faction_id": {
      "$ref": "../defs/common.schema.json#/$defs/entity-id",
      "description": "Owning faction. A chassis shared across factions has a distinct composition per faction under the same `unit_id`, so compositions are keyed by (faction_id, unit_id)."
    },
    "models": {
      "type": "array",
      "items": {
        "type": "object",
        "properties": {
          "name": { "type": "string", "minLength": 1 },
          "profile_name": {
            "oneOf": [
              { "type": "string", "minLength": 1 },
              { "type": "null" }
            ]
          },
          "min": { "type": "integer", "minimum": 0 },
          "max": { "type": "integer", "minimum": 1 },
          "default_weapon_ids": {
            "description": "The model's no-choice equipment multiset, used by base_loadout. It must describe a legal default configuration even when whole-model variants are present; it does not implicitly add another selectable variant.",
            "type": "array",
            "items": { "$ref": "../defs/common.schema.json#/$defs/entity-id" }
          },
          "is_leader_model": { "type": "boolean", "default": false },
          "excluded_from_enhancements": {
            "type": "boolean",
            "default": false,
            "description": "True when this model cannot be given an Enhancement even though it is a CHARACTER (e.g. Ogryn Bodyguard, Transcendent C'tan). An Enhancement needs a model in the unit that is not excluded."
          },
          "base_size_mm": {
            "description": "This model's base. Absent when no base could be resolved for the model.",
            "$ref": "../defs/common.schema.json#/$defs/base-size"
          },
          "hull_shape_id": {
            "description": "Optional reference to a hull-shape entity giving this model's 2D collision polygon, used instead of the circular/oval base footprint. By convention a model carrying this should set `base_size_mm.shape` to \"hull\".",
            "oneOf": [
              { "$ref": "../defs/common.schema.json#/$defs/entity-id" },
              { "type": "null" }
            ]
          },
          "loadout_variants": {
            "description": "Mutually exclusive whole-model loadout alternatives, expressed as named peers rather than deltas against default_weapon_ids. Each selected variant supplies one model's complete initial equipment multiset; repeated IDs preserve multiplicity. Compatible item-level wargear_options may transform that loadout but must satisfy the resulting variant's selection limits and all equipment budgets. When absent, models start with default_weapon_ids. When present, default_weapon_ids still governs base_loadout and is not replaced.",
            "type": "array",
            "minItems": 1,
            "items": {
              "type": "object",
              "properties": {
                "name": {
                  "description": "The source peer's own model name (e.g. \"Boy w/ Big shoota\"). Unique within this model row.",
                  "type": "string",
                  "minLength": 1
                },
                "weapon_ids": {
                  "description": "This variant's complete per-model equipment multiset. Every ID must be in the owning unit's weapon_ids or resolve to faction wargear. Repeated IDs mean multiple copies; an empty multiset is not a loadout.",
                  "type": "array",
                  "minItems": 1,
                  "items": { "$ref": "../defs/common.schema.json#/$defs/entity-id" }
                },
                "max_count": {
                  "description": "Ceiling on how many models of this row may take this variant, when the source states one on the variant itself. Shared and ratio-scaled ceilings live in `loadout_variant_budgets` instead.",
                  "type": "integer",
                  "minimum": 1
                }
              },
              "required": ["name", "weapon_ids"],
              "additionalProperties": false
            }
          },
          "loadout_variant_budgets": {
            "description": "Caps over how many variant selections this model row may make, counting SELECTED VARIANTS rather than final weapon ids (two variants sharing a weapon must not charge each other's allowance). A singleton `variant_names` is an individual cap, several names a shared pool, and intersecting budgets a ratio plus a hard ceiling. The selected count across `variant_names` must not exceed `floor(scope_model_count * count / per_models)`, or simply `count` when `per_models` is 0.",
            "type": "array",
            "minItems": 1,
            "items": {
              "type": "object",
              "properties": {
                "variant_names": {
                  "description": "The `loadout_variants[].name` values sharing this allowance. Every name must exist in this same model row.",
                  "type": "array",
                  "minItems": 1,
                  "items": { "type": "string", "minLength": 1 }
                },
                "count": { "type": "integer", "minimum": 1 },
                "per_models": {
                  "description": "Models required per `count` selections. 0 means the flat limit `count`, independent of squad size.",
                  "type": "integer",
                  "minimum": 0
                },
                "scope": {
                  "description": "Which model count scales the allowance: the whole unit, or just this model row.",
                  "enum": ["unit", "model-row"]
                }
              },
              "required": ["variant_names", "count", "per_models", "scope"],
              "additionalProperties": false
            }
          }
        },
        "required": ["name", "min", "max"],
        "additionalProperties": false
      },
      "minItems": 1
    },
    "tiers": {
      "description": "The discrete buildable squad sizes (GW's per-datasheet unit-composition rows). Each tier gives a per-model count range; a legal squad must match exactly one tier. When absent, the squad is treated as a single implicit tier equal to `models[]`. The top-level `models[]` min/max are the aggregate envelope (min-of-mins / max-of-maxes) across the tiers, so consumers that read only `models[]` still see the full range.",
      "type": "array",
      "minItems": 1,
      "items": {
        "type": "object",
        "properties": {
          "models": {
            "description": "One entry per top-level `models[]` row, matched by `name`, giving this tier's count range for that model type.",
            "type": "array",
            "minItems": 1,
            "items": {
              "type": "object",
              "properties": {
                "name": { "type": "string", "minLength": 1 },
                "min": { "type": "integer", "minimum": 0 },
                "max": { "type": "integer", "minimum": 1 }
              },
              "required": ["name", "min", "max"],
              "additionalProperties": false
            }
          }
        },
        "required": ["models"],
        "additionalProperties": false
      }
    },
    "game_version": { "$ref": "../defs/game-version-ref.schema.json" },
    "game_modes": {
      "$ref": "../defs/common.schema.json#/$defs/game-modes",
      "description": "Game modes this unit composition is legal or authored for; absent implies matched-play."
    }
  },
  "required": ["unit_id", "faction_id", "models", "game_version"],
  "additionalProperties": false
}
