[
  {
    "unit_id": "land-raider-redeemer",
    "faction_id": "grey-knights",
    "models": [
      {
        "name": "Land Raider Redeemer",
        "min": 1,
        "max": 1,
        "is_leader_model": false,
        "base_size_mm": {
          "shape": "hull",
          "draft": true
        },
        "default_weapon_ids": [
          "twin-assault-cannon",
          "armoured-tracks",
          "flamestorm-cannon",
          "flamestorm-cannon"
        ]
      }
    ],
    "game_version": {
      "edition": "11th",
      "dataslate": "mfm-995"
    },
    "tiers": [
      {
        "models": [
          {
            "name": "Land Raider Redeemer",
            "min": 1,
            "max": 1
          }
        ]
      }
    ]
  },
  {
    "unit_id": "grand-master-in-nemesis-dreadknight",
    "faction_id": "grey-knights",
    "models": [
      {
        "name": "Grand Master in Nemesis Dreadknight",
        "min": 1,
        "max": 1,
        "is_leader_model": false,
        "base_size_mm": {
          "shape": "oval",
          "width": 120,
          "length": 92
        },
        "default_weapon_ids": [
          "dreadfists"
        ]
      }
    ],
    "game_version": {
      "edition": "11th",
      "dataslate": "mfm-995"
    },
    "tiers": [
      {
        "models": [
          {
            "name": "Grand Master in Nemesis Dreadknight",
            "min": 1,
            "max": 1
          }
        ]
      }
    ]
  },
  {
    "unit_id": "land-raider-crusader",
    "faction_id": "grey-knights",
    "models": [
      {
        "name": "Land Raider Crusader",
        "min": 1,
        "max": 1,
        "is_leader_model": false,
        "base_size_mm": {
          "shape": "hull",
          "draft": true
        },
        "default_weapon_ids": [
          "hurricane-bolter",
          "hurricane-bolter",
          "twin-assault-cannon",
          "armoured-tracks"
        ]
      }
    ],
    "game_version": {
      "edition": "11th",
      "dataslate": "mfm-995"
    },
    "tiers": [
      {
        "models": [
          {
            "name": "Land Raider Crusader",
            "min": 1,
            "max": 1
          }
        ]
      }
    ]
  },
  {
    "unit_id": "grand-master",
    "faction_id": "grey-knights",
    "models": [
      {
        "name": "Grand Master",
        "min": 1,
        "max": 1,
        "is_leader_model": false,
        "base_size_mm": {
          "shape": "round",
          "diameter": 40
        },
        "default_weapon_ids": [
          "nemesis-force-weapon",
          "storm-bolter-grand-master"
        ]
      }
    ],
    "game_version": {
      "edition": "11th",
      "dataslate": "mfm-995"
    },
    "tiers": [
      {
        "models": [
          {
            "name": "Grand Master",
            "min": 1,
            "max": 1
          }
        ]
      }
    ]
  },
  {
    "unit_id": "razorback",
    "faction_id": "grey-knights",
    "models": [
      {
        "name": "Razorback",
        "min": 1,
        "max": 1,
        "is_leader_model": false,
        "base_size_mm": {
          "shape": "hull",
          "draft": true
        },
        "default_weapon_ids": [
          "twin-heavy-bolter",
          "armoured-tracks-razorback"
        ]
      }
    ],
    "game_version": {
      "edition": "11th",
      "dataslate": "mfm-995"
    },
    "tiers": [
      {
        "models": [
          {
            "name": "Razorback",
            "min": 1,
            "max": 1
          }
        ]
      }
    ]
  },
  {
    "unit_id": "purifier-squad",
    "faction_id": "grey-knights",
    "models": [
      {
        "name": "Knight of the Flame",
        "profile_name": "Purifier",
        "min": 1,
        "max": 1,
        "default_weapon_ids": [
          "nemesis-force-weapon-purifier-squad",
          "storm-bolter-purifier-squad",
          "purifying-flame"
        ],
        "is_leader_model": true,
        "base_size_mm": {
          "shape": "round",
          "diameter": 32
        }
      },
      {
        "name": "Purifier",
        "min": 4,
        "max": 9,
        "default_weapon_ids": [
          "storm-bolter-purifier-squad",
          "purifying-flame",
          "nemesis-force-weapon-purifier-squad"
        ],
        "is_leader_model": false,
        "base_size_mm": {
          "shape": "round",
          "diameter": 32
        },
        "loadout_variants": [
          {
            "name": "Purifier",
            "weapon_ids": [
              "nemesis-force-weapon-purifier-squad",
              "storm-bolter-purifier-squad",
              "purifying-flame"
            ],
            "max_count": 9
          },
          {
            "name": "Purifier w/ incinerator",
            "weapon_ids": [
              "close-combat-weapon",
              "incinerator",
              "purifying-flame"
            ],
            "max_count": 4
          },
          {
            "name": "Purifier w/ psilencer",
            "weapon_ids": [
              "close-combat-weapon",
              "psilencer-purifier-squad",
              "purifying-flame"
            ],
            "max_count": 4
          },
          {
            "name": "Purifier w/ psycannon",
            "weapon_ids": [
              "close-combat-weapon",
              "psycannon-purifier-squad",
              "purifying-flame"
            ],
            "max_count": 4
          }
        ],
        "loadout_variant_budgets": [
          {
            "variant_names": [
              "Purifier w/ incinerator",
              "Purifier w/ psilencer",
              "Purifier w/ psycannon"
            ],
            "count": 2,
            "per_models": 5,
            "scope": "unit",
            "stepped": true
          }
        ]
      }
    ],
    "game_version": {
      "edition": "11th",
      "dataslate": "mfm-995"
    },
    "tiers": [
      {
        "models": [
          {
            "name": "Knight of the Flame",
            "min": 1,
            "max": 1
          },
          {
            "name": "Purifier",
            "min": 4,
            "max": 4
          }
        ]
      },
      {
        "models": [
          {
            "name": "Knight of the Flame",
            "min": 1,
            "max": 1
          },
          {
            "name": "Purifier",
            "min": 5,
            "max": 9
          }
        ]
      }
    ]
  },
  {
    "unit_id": "nemesis-dreadknight",
    "faction_id": "grey-knights",
    "models": [
      {
        "name": "Nemesis Dreadknight",
        "min": 1,
        "max": 1,
        "is_leader_model": false,
        "base_size_mm": {
          "shape": "oval",
          "width": 120,
          "length": 92
        },
        "default_weapon_ids": [
          "dreadfists"
        ]
      }
    ],
    "game_version": {
      "edition": "11th",
      "dataslate": "mfm-995"
    },
    "tiers": [
      {
        "models": [
          {
            "name": "Nemesis Dreadknight",
            "min": 1,
            "max": 1
          }
        ]
      }
    ]
  },
  {
    "unit_id": "grey-knights-thunderhawk-gunship",
    "faction_id": "grey-knights",
    "models": [
      {
        "name": "Grey Knights Thunderhawk Gunship",
        "min": 1,
        "max": 1,
        "is_leader_model": false,
        "base_size_mm": {
          "shape": "unique",
          "draft": true
        },
        "default_weapon_ids": [
          "thunderhawk-heavy-cannon",
          "armoured-hull",
          "lascannon",
          "lascannon",
          "thunderhawk-cluster-bombs",
          "twin-heavy-bolter",
          "twin-heavy-bolter",
          "twin-heavy-bolter",
          "twin-heavy-bolter"
        ]
      }
    ],
    "game_version": {
      "edition": "11th",
      "dataslate": "mfm-995"
    },
    "tiers": [
      {
        "models": [
          {
            "name": "Grey Knights Thunderhawk Gunship",
            "min": 1,
            "max": 1
          }
        ]
      }
    ]
  },
  {
    "unit_id": "rhino",
    "faction_id": "grey-knights",
    "models": [
      {
        "name": "Rhino",
        "min": 1,
        "max": 1,
        "is_leader_model": false,
        "base_size_mm": {
          "shape": "hull",
          "draft": true
        },
        "default_weapon_ids": [
          "storm-bolter-rhino",
          "armoured-tracks-rhino"
        ]
      }
    ],
    "game_version": {
      "edition": "11th",
      "dataslate": "mfm-995"
    },
    "tiers": [
      {
        "models": [
          {
            "name": "Rhino",
            "min": 1,
            "max": 1
          }
        ]
      }
    ]
  },
  {
    "unit_id": "brother-captain",
    "faction_id": "grey-knights",
    "models": [
      {
        "name": "Brother-Captain",
        "min": 1,
        "max": 1,
        "is_leader_model": false,
        "base_size_mm": {
          "shape": "round",
          "diameter": 40
        },
        "default_weapon_ids": [
          "nemesis-force-weapon-brother-captain",
          "storm-bolter-brother-captain"
        ]
      }
    ],
    "game_version": {
      "edition": "11th",
      "dataslate": "mfm-995"
    },
    "tiers": [
      {
        "models": [
          {
            "name": "Brother-Captain",
            "min": 1,
            "max": 1
          }
        ]
      }
    ]
  },
  {
    "unit_id": "venerable-dreadnought",
    "faction_id": "grey-knights",
    "models": [
      {
        "name": "Venerable Dreadnought",
        "min": 1,
        "max": 1,
        "is_leader_model": false,
        "base_size_mm": {
          "shape": "round",
          "diameter": 60
        },
        "default_weapon_ids": [
          "dreadnought-combat-weapon",
          "storm-bolter-venerable-dreadnought",
          "assault-cannon"
        ]
      }
    ],
    "game_version": {
      "edition": "11th",
      "dataslate": "mfm-995"
    },
    "tiers": [
      {
        "models": [
          {